{
  "$schema": "../schemas/tool-detail.schema.json",
  "formatVersion": "roslyn-workbench-tool-reference/v1",
  "productVersion": "0.1.0",
  "sourceTag": "0.1.0",
  "commit": "a4df43bdf65904c6b495054d88ac5a270142657a",
  "name": "workspace-close",
  "title": "Workspace Close",
  "area": "Server",
  "category": "Workspaces",
  "operationKind": "Mutation",
  "summary": "Closes the selected workspace.",
  "availability": "Built in and published by default.",
  "documentationUrl": "https://lantean-code.github.io/roslyn-workbench-mcp/0.1.0/reference/tools/workspace-close.html",
  "tool": {
    "name": "workspace-close",
    "title": "Workspace Close",
    "description": "Closes the selected workspace.",
    "inputSchema": {
      "type": "object",
      "properties": {
        "workspace": {
          "description": "Provide workspaceId, alias, path, or any combination.",
          "type": [
            "object",
            "null"
          ],
          "properties": {
            "workspaceId": {
              "type": "string",
              "format": "uuid"
            },
            "alias": {
              "type": "string"
            },
            "path": {
              "description": "Absolute workspace path.",
              "type": "string"
            }
          }
        }
      }
    },
    "outputSchema": {
      "type": "object",
      "oneOf": [
        {
          "type": "object",
          "required": [
            "ok",
            "data"
          ],
          "properties": {
            "ok": {
              "const": true,
              "description": "Whether the tool invocation succeeded."
            },
            "data": {
              "type": [
                "object",
                "null"
              ],
              "properties": {
                "closedPath": {
                  "description": "The path that was closed.",
                  "type": "string"
                }
              },
              "required": [
                "closedPath"
              ],
              "description": "Tool-specific result payload."
            },
            "snapshot": {
              "type": "object",
              "properties": {
                "workspaceId": {
                  "type": "string",
                  "format": "uuid"
                },
                "workspaceEpoch": {
                  "type": "integer"
                },
                "snapshotId": {
                  "type": "string",
                  "format": "uuid"
                },
                "transactionRevision": {
                  "type": [
                    "integer",
                    "null"
                  ]
                }
              },
              "required": [
                "workspaceId",
                "workspaceEpoch",
                "snapshotId",
                "transactionRevision"
              ],
              "description": "Exact immutable workspace snapshot associated with the result, when available."
            }
          }
        },
        {
          "type": "object",
          "required": [
            "ok",
            "error"
          ],
          "properties": {
            "ok": {
              "const": false,
              "description": "Whether the tool invocation succeeded."
            },
            "error": {
              "type": "object",
              "properties": {
                "code": {
                  "description": "Stable machine-readable error code.",
                  "type": "string"
                },
                "message": {
                  "description": "Human-readable explanation of the failure.",
                  "type": "string"
                },
                "correlationId": {
                  "description": "Correlation identifier for matching the failure to server-side diagnostics, when available.",
                  "type": [
                    "string",
                    "null"
                  ]
                }
              },
              "required": [
                "code",
                "message"
              ],
              "description": "Structured error details when the invocation failed."
            },
            "continuation": {
              "oneOf": [
                {
                  "type": "object",
                  "additionalProperties": false,
                  "required": [
                    "kind",
                    "tool",
                    "instruction"
                  ],
                  "properties": {
                    "kind": {
                      "const": "CallTool",
                      "description": "Action required before the original request can continue."
                    },
                    "instruction": {
                      "type": "string",
                      "description": "Agent-facing instruction explaining how to continue.",
                      "minLength": 1
                    },
                    "tool": {
                      "type": "string",
                      "description": "Tool to call before continuing the original request.",
                      "minLength": 1
                    }
                  }
                },
                {
                  "type": "object",
                  "additionalProperties": false,
                  "required": [
                    "kind",
                    "tools",
                    "instruction"
                  ],
                  "properties": {
                    "kind": {
                      "const": "ChooseTool",
                      "description": "Action required before the original request can continue."
                    },
                    "instruction": {
                      "type": "string",
                      "description": "Agent-facing instruction explaining how to continue.",
                      "minLength": 1
                    },
                    "tools": {
                      "type": "array",
                      "description": "Allowed tool choices from which the agent must select one.",
                      "minItems": 1,
                      "uniqueItems": true,
                      "items": {
                        "type": "string",
                        "description": "Name of a tool the agent may choose.",
                        "minLength": 1
                      }
                    }
                  }
                },
                {
                  "type": "object",
                  "additionalProperties": false,
                  "required": [
                    "kind",
                    "instruction"
                  ],
                  "properties": {
                    "kind": {
                      "const": "RetryRequest",
                      "description": "Action required before the original request can continue."
                    },
                    "instruction": {
                      "type": "string",
                      "description": "Agent-facing instruction explaining how to continue.",
                      "minLength": 1
                    }
                  }
                },
                {
                  "type": "object",
                  "additionalProperties": false,
                  "required": [
                    "kind",
                    "instruction"
                  ],
                  "properties": {
                    "kind": {
                      "const": "ReviseRequest",
                      "description": "Action required before the original request can continue."
                    },
                    "instruction": {
                      "type": "string",
                      "description": "Agent-facing instruction explaining how to continue.",
                      "minLength": 1
                    }
                  }
                },
                {
                  "type": "object",
                  "additionalProperties": false,
                  "required": [
                    "kind",
                    "instruction"
                  ],
                  "properties": {
                    "kind": {
                      "const": "ResolveExternally",
                      "description": "Action required before the original request can continue."
                    },
                    "instruction": {
                      "type": "string",
                      "description": "Agent-facing instruction explaining how to continue.",
                      "minLength": 1
                    }
                  }
                }
              ],
              "description": "Action the agent should take before retrying or continuing."
            }
          }
        }
      ]
    },
    "annotations": {
      "title": "Workspace Close",
      "destructiveHint": false,
      "idempotentHint": false,
      "openWorldHint": false,
      "readOnlyHint": false
    }
  },
  "examples": []
}
